title,topic_group,skill_groups,skills,grade_low,grade_high,author_id,created_at,figma_link,description,extended_description
AI Algorithms,Artificial Intelligence (AI),Analytics Processes,Fluency with Data Software Engineering,2,4,KcYxc4r2dUhd3fRXMWNreLvh7U52,2024-01-28,https://www.figma.com/file/SABujfIEwzpa1NuWiVS3RR/The-Product-Map-3.1?type=whiteboard&node-id=317-35613&t=aENtCOSbBGKwDMTu-4,Master AI algorithms. Develop fluency with data and software engineering skills in this advanced analytics course,"""AI Algorithms"" is a deep dive into the core algorithms powering artificial intelligence systems. As part of the Artificial Intelligence (AI) domain, this course explores the fundamental principles and applications of AI algorithms. Covering topics such as machine learning, neural networks, and natural language processing, participants will gain a comprehensive understanding of AI algorithms' inner workings. Skills cultivated include a high level of 'Fluency with Data' to effectively analyze and manipulate datasets, as well as proficiency in 'Software Engineering' practices for implementing and optimizing AI algorithms. By the course's end, participants will be equipped with the knowledge and skills to design, develop, and deploy powerful AI solutions across various domains."
AI Use Cases,Artificial Intelligence (AI),Product Processes,Strategic Impact Software Engineering,3,5,KcYxc4r2dUhd3fRXMWNreLvh7U52,2024-01-28,https://www.figma.com/file/SABujfIEwzpa1NuWiVS3RR/The-Product-Map-3.1?type=whiteboard&node-id=321-36793&t=aENtCOSbBGKwDMTu-4,Explore AI applications. Hone strategic impact and software engineering skills in this comprehensive AI use cases course,"""AI Use Cases"" explores practical applications and strategic implications of artificial intelligence. Situated within the Artificial Intelligence (AI) domain, this course delves into real-world scenarios where AI technologies drive transformative outcomes. Participants will examine diverse use cases across industries, from predictive analytics in finance to image recognition in healthcare. Skills cultivated include understanding the 'Strategic Impact' of AI implementations and proficiency in 'Software Engineering' practices for developing AI solutions. By the course's conclusion, participants will possess the expertise to identify, evaluate, and implement AI use cases that align with organizational objectives, unlocking new opportunities for innovation and efficiency."
Product Metrics,"KPIs, Metrics",Analytics,Fluency with Data Measuring Progress KPIs,1,4,KcYxc4r2dUhd3fRXMWNreLvh7U52,2024-01-28,https://www.figma.com/file/SABujfIEwzpa1NuWiVS3RR/The-Product-Map-3.1?type=whiteboard&node-id=111-1506&t=aENtCOSbBGKwDMTu-4,Master product metrics. Develop fluency with data and progress measurement skills in this focused analytics course,"""Product Metrics"" is a focused exploration of key performance indicators (KPIs) and metrics essential for evaluating product success. Situated within the domain of KPIs and Metrics, this course provides insights into selecting, tracking, and interpreting relevant metrics to measure product performance effectively. Participants will delve into topics such as user engagement, retention rates, and customer satisfaction metrics. Skills cultivated include a high level of 'Fluency with Data' to analyze and interpret metrics, as well as proficiency in 'Measuring Progress and KPIs' to gauge product success comprehensively. By course completion, participants will be equipped to leverage data-driven insights to optimize product strategies and drive sustainable growth."
Application Metrics,"KPIs, Metrics",Analytics,Fluency with Data Measuring Progress KPIs,1,3,KcYxc4r2dUhd3fRXMWNreLvh7U52,2024-01-28,https://www.figma.com/file/SABujfIEwzpa1NuWiVS3RR/The-Product-Map-3.1?type=whiteboard&node-id=111-1519&t=aENtCOSbBGKwDMTu-4,Optimize application metrics. Enhance fluency with data and progress measurement skills in this specialized analytics course,"""Application Metrics"" is a comprehensive study of key performance indicators (KPIs) and metrics crucial for assessing the performance and effectiveness of applications. Positioned within the domain of KPIs and Metrics, this course delves into the selection, monitoring, and interpretation of metrics essential for evaluating application performance, user experience, and overall success. Participants will explore various metrics such as user engagement, conversion rates, and system performance indicators. Skills honed include a robust proficiency in 'Fluency with Data' to analyze and interpret metrics effectively, alongside adeptness in 'Measuring Progress and KPIs' to evaluate application performance comprehensively. By the course's conclusion, participants will be well-equipped to utilize data-driven insights to optimize applications and drive continuous improvement."
Marketing Metrics,"KPIs, Metrics",Product Customer,Business Goals Ownership Product Marketing,1,5,KcYxc4r2dUhd3fRXMWNreLvh7U52,2024-01-28,https://www.figma.com/file/SABujfIEwzpa1NuWiVS3RR/The-Product-Map-3.1?type=whiteboard&node-id=114-1943&t=aENtCOSbBGKwDMTu-4,Refine marketing metrics. Cultivate business goals ownership and product marketing skills in this essential KPIs course,"""Marketing Metrics"" provides a comprehensive understanding of key performance indicators (KPIs) and metrics crucial for evaluating the effectiveness of marketing campaigns and strategies. Situated within the domain of KPIs and Metrics, this course explores the selection, tracking, and interpretation of metrics essential for measuring marketing performance, campaign success, and ROI. Participants will delve into various metrics such as conversion rates, customer acquisition cost, and return on ad spend (ROAS). Skills cultivated include taking ownership of 'Business Goals' to align marketing efforts with organizational objectives and proficiency in 'Product Marketing' strategies to optimize campaign performance. By the course's conclusion, participants will be empowered to leverage data-driven insights to refine marketing strategies, enhance targeting, and drive impactful results."
Product Analytics,Analytics,Product Analytics,Business Goals Ownership Fluency with Data,1,5,KcYxc4r2dUhd3fRXMWNreLvh7U52,2024-01-28,https://www.figma.com/file/SABujfIEwzpa1NuWiVS3RR/The-Product-Map-3.1?type=whiteboard&node-id=456-16395&t=aENtCOSbBGKwDMTu-4,Unlock product insights. Develop business goals ownership and fluency with data skills in this analytics-focused course,"""Product Analytics"" is a focused exploration of leveraging data analytics to drive product innovation and success. Positioned within the Analytics domain, this course equips participants with the tools and techniques to extract actionable insights from product-related data. Topics include understanding user behavior, identifying product usage patterns, and optimizing features for maximum impact. Skills cultivated encompass taking ownership of 'Business Goals' to align product development with organizational objectives and achieving a high level of 'Fluency with Data' for effective analysis and interpretation. By course completion, participants will possess the expertise to leverage analytics to make informed decisions, enhance user experiences, and drive continuous improvement in product development and strategy."
Data Analytics,Analytics,Analytics,Fluency with Data Measuring Progress KPIs,1,4,KcYxc4r2dUhd3fRXMWNreLvh7U52,2024-01-28,https://www.figma.com/file/SABujfIEwzpa1NuWiVS3RR/The-Product-Map-3.1?type=whiteboard&node-id=456-16421&t=aENtCOSbBGKwDMTu-4,Master data analytics. Enhance fluency with data and progress measurement skills in this comprehensive analytics course,"""Data Analytics"" is an immersive journey into the world of analytics, focusing on harnessing data to derive meaningful insights and drive informed decision-making. Positioned within the Analytics domain, this course provides participants with the foundational knowledge and skills necessary to navigate the data landscape effectively. Topics include data collection, cleaning, analysis, and visualization techniques. Skills cultivated encompass a high level of 'Fluency with Data' for proficient data manipulation and interpretation, as well as expertise in 'Measuring Progress and KPIs' to evaluate performance and guide strategic initiatives. By the course's conclusion, participants will be equipped to extract valuable insights from data, enabling them to make data-driven decisions and unlock new opportunities for growth and innovation."
Unit Economy Calculation,Unit Economics,Analytics,Fluency with Data Measuring Progress KPIs,1,5,KcYxc4r2dUhd3fRXMWNreLvh7U52,2024-01-28,https://www.figma.com/file/SABujfIEwzpa1NuWiVS3RR/The-Product-Map-3.1?type=whiteboard&node-id=151-3689&t=aENtCOSbBGKwDMTu-4,Refine unit economics. Cultivate fluency with data and progress measurement skills in this specialized analytics course,"""Unit Economy Calculation"" is a focused study on understanding and evaluating the unit economics of a business. Positioned within the Unit Economics domain, this course equips participants with the tools and methodologies to analyze the costs and revenues associated with individual units or transactions. Topics include cost structures, revenue streams, and profitability metrics at a granular level. Skills cultivated encompass a high level of 'Fluency with Data' for thorough analysis of financial and operational data, as well as expertise in 'Measuring Progress and KPIs' to assess the performance and viability of unit economics models. By course completion, participants will be proficient in conducting unit economy analyses, enabling them to make informed decisions and optimize business operations for sustainable growth and profitability."
Unit Economy Improvements,Unit Economics,Product Analytics,Business Goals Ownership,3,5,KcYxc4r2dUhd3fRXMWNreLvh7U52,2024-01-28,https://www.figma.com/file/SABujfIEwzpa1NuWiVS3RR/The-Product-Map-3.1?type=whiteboard&node-id=151-3702&t=aENtCOSbBGKwDMTu-4,Optimize unit economics. Develop business goals ownership and analytics skills in this targeted course,"""Unit Economy Improvements"" focuses on enhancing the unit economics of a business through strategic interventions and optimizations. Positioned within the Unit Economics domain, this course equips participants with the knowledge and tools to identify inefficiencies and implement targeted improvements in cost structures, revenue streams, and operational processes. Topics include root cause analysis, cost reduction strategies, and revenue optimization techniques. Skills cultivated encompass taking ownership of 'Business Goals' to align improvement efforts with organizational objectives, as well as proficiency in leveraging 'Analytics' to identify and prioritize improvement opportunities effectively. By course completion, participants will be equipped to drive meaningful enhancements in unit economics, leading to increased profitability and sustainable growth for the business."
Financial Management,Finance,Product Processes,Business Goals Ownership Product Vision Planning,3,5,KcYxc4r2dUhd3fRXMWNreLvh7U52,2024-01-28,https://www.figma.com/file/SABujfIEwzpa1NuWiVS3RR/The-Product-Map-3.1?type=whiteboard&node-id=276-30249&t=aENtCOSbBGKwDMTu-4,Master financial management. Cultivate business goals ownership and product vision & planning skills in this essential finance course,"""Financial Management"" provides a comprehensive understanding of managing finances to achieve business goals effectively. Positioned within the Finance domain, this course covers essential topics such as budgeting, forecasting, and financial analysis. Participants will learn to navigate financial statements, assess investment opportunities, and optimize resource allocation. Skills cultivated include taking ownership of 'Business Goals' to align financial decisions with organizational objectives, and developing a robust 'Product Vision & Planning' framework to drive strategic financial initiatives. By course completion, participants will possess the expertise to make informed financial decisions, mitigate risks, and maximize value creation for the organization."
Financial Reporting,Finance,Product Analytics,Business Goals Ownership Measuring Progress KPIs,4,5,KcYxc4r2dUhd3fRXMWNreLvh7U52,2024-01-28,https://www.figma.com/file/SABujfIEwzpa1NuWiVS3RR/The-Product-Map-3.1?type=whiteboard&node-id=275-29858&t=aENtCOSbBGKwDMTu-4,Excel in financial reporting. Develop business goals ownership and progress measurement skills in this analytics-driven finance course,"""Financial Reporting"" provides a comprehensive overview of the principles and practices involved in presenting financial information effectively. Situated within the Finance domain, this course delves into the preparation, analysis, and interpretation of financial reports. Participants will explore topics such as balance sheets, income statements, and cash flow statements, gaining insights into how financial data reflects business performance. Skills cultivated include taking ownership of 'Business Goals' to ensure alignment between financial reporting and organizational objectives, as well as proficiency in 'Measuring Progress and KPIs' to evaluate financial performance comprehensively. By course completion, participants will be equipped to prepare accurate and insightful financial reports that facilitate informed decision-making and transparency within the organization."
Requirements Management,Backlog,Analytics Processes,Stakeholder Management Backlog Management,1,4,KcYxc4r2dUhd3fRXMWNreLvh7U52,2024-01-28,https://www.figma.com/file/SABujfIEwzpa1NuWiVS3RR/The-Product-Map-3.1?type=whiteboard&node-id=264-21002&t=aENtCOSbBGKwDMTu-4,Master requirements management. Develop stakeholder management and backlog management skills in this analytics-driven course,"""Requirements Management"" offers a structured approach to handle project requirements effectively. Situated within the Backlog domain, this course provides insights into gathering, documenting, and prioritizing project requirements. Participants will delve into stakeholder management strategies to ensure alignment between project objectives and stakeholder needs. Additionally, they will learn efficient backlog management techniques to organize and prioritize requirements for successful project delivery. Skills cultivated include adept 'Stakeholder Management' to facilitate clear communication and collaboration, along with proficiency in 'Backlog Management' to streamline the development process. By course completion, participants will be equipped with the skills to effectively manage project requirements, leading to improved project outcomes and stakeholder satisfaction."
Stakeholder Analysis,Backlog,Analytics People,Stakeholder Management Communication,3,5,KcYxc4r2dUhd3fRXMWNreLvh7U52,2024-01-28,https://www.figma.com/file/SABujfIEwzpa1NuWiVS3RR/The-Product-Map-3.1?type=whiteboard&node-id=264-21024&t=aENtCOSbBGKwDMTu-4,Refine stakeholder analysis. Cultivate stakeholder management and communication skills in this analytics-driven course,"""Stakeholder Analysis"" provides a structured approach to identify, assess, and manage stakeholders' interests and expectations within a project or initiative. Situated within the Backlog domain, this course equips participants with the tools and techniques to conduct comprehensive stakeholder analyses. Participants will learn to identify key stakeholders, assess their influence and interest levels, and develop tailored communication and engagement strategies. Skills cultivated include adept 'Stakeholder Management' to foster positive relationships and collaboration, alongside effective 'Communication' skills to convey information clearly and address stakeholder needs. By course completion, participants will be equipped to navigate stakeholder dynamics effectively, leading to improved project outcomes and stakeholder satisfaction."
User Story Mapping,Backlog,Processes,Product Vision Planning Backlog Management,1,3,KcYxc4r2dUhd3fRXMWNreLvh7U52,2024-01-28,https://www.figma.com/file/SABujfIEwzpa1NuWiVS3RR/The-Product-Map-3.1?type=whiteboard&node-id=264-20984&t=aENtCOSbBGKwDMTu-4,Master user story mapping. Focus on product vision & planning and backlog management skills in this essential course,"""User Story Mapping"" presents a structured approach to visualizing and organizing user requirements within a project or product development cycle. Positioned within the Backlog domain, this course provides participants with the tools and methodologies to create user story maps effectively. Participants will learn to align user stories with product vision and goals, prioritize features, and plan iterative development cycles. Skills cultivated include developing a clear 'Product Vision & Planning' framework to guide user story mapping exercises and proficient 'Backlog Management' techniques to maintain and refine the user story map over time. By course completion, participants will be equipped to leverage user story mapping as a powerful tool for fostering collaboration, enhancing product understanding, and driving successful project outcomes."
Prioritization,Backlog,Processes,Product Vision Planning Backlog Management,1,5,KcYxc4r2dUhd3fRXMWNreLvh7U52,2024-01-28,https://www.figma.com/file/SABujfIEwzpa1NuWiVS3RR/The-Product-Map-3.1?type=whiteboard&node-id=264-20941&t=aENtCOSbBGKwDMTu-4,Hone prioritization skills. Focus on product vision & planning and backlog management in this crucial course,"""Prioritization"" is a crucial skill in product development and project management, ensuring that the most valuable work is completed first. Situated within the Backlog domain, this course provides participants with the methodologies and techniques to prioritize tasks, features, or user stories effectively. Participants will learn to align prioritization decisions with the overarching 'Product Vision & Planning' framework, considering factors such as business goals, user needs, and technical constraints. Skills cultivated include adept 'Backlog Management' practices to maintain and refine prioritized lists of tasks or features. By course completion, participants will be equipped to make informed prioritization decisions, optimize resource allocation, and maximize the value delivered to stakeholders."
Agile Thinking,Agile,Product Processes,Strategic Impact Product Vision Planning,1,5,KcYxc4r2dUhd3fRXMWNreLvh7U52,2024-01-28,https://www.figma.com/file/SABujfIEwzpa1NuWiVS3RR/The-Product-Map-3.1?type=whiteboard&node-id=183-8585&t=aENtCOSbBGKwDMTu-4,Embrace Agile mindset. Develop strategic impact and product vision & planning skills in this essential Agile course,"""Agile Thinking"" is a foundational exploration of the Agile methodology, emphasizing its principles and mindset for effective project management and product development. Situated within the Agile domain, this course equips participants with the mindset and tools to embrace agility in their work. Participants will delve into Agile principles such as adaptability, collaboration, and continuous improvement, fostering a culture of innovation and responsiveness. Skills cultivated include understanding the 'Strategic Impact' of Agile methodologies on business outcomes and developing a robust 'Product Vision & Planning' framework aligned with Agile principles. By course completion, participants will be empowered to apply Agile thinking to drive successful project outcomes, enhance team collaboration, and deliver value to stakeholders iteratively."
Kanban,Agile,Processes,Product Vision Planning Backlog Management,1,3,KcYxc4r2dUhd3fRXMWNreLvh7U52,2024-01-28,https://www.figma.com/file/SABujfIEwzpa1NuWiVS3RR/The-Product-Map-3.1?type=whiteboard&node-id=183-8760&t=aENtCOSbBGKwDMTu-4,Master Kanban methodology. Focus on product vision & planning and backlog management skills in this specialized Agile course,"""Kanban"" introduces participants to a popular Agile framework focused on visualizing work, limiting work in progress, and maximizing efficiency. Positioned within the Agile domain, this course provides a deep dive into the principles and practices of Kanban methodology. Participants will learn to create and manage Kanban boards, visualize workflow, and optimize processes for continuous improvement. Skills cultivated include developing a clear 'Product Vision & Planning' framework to align Kanban implementation with project goals and proficient 'Backlog Management' techniques to prioritize and manage work items effectively. By course completion, participants will be equipped to implement Kanban methodologies, streamline workflows, and enhance productivity and collaboration within their teams."
Scrum,Agile,Processes,Product Vision Planning Backlog Management,1,3,KcYxc4r2dUhd3fRXMWNreLvh7U52,2024-01-28,https://www.figma.com/file/SABujfIEwzpa1NuWiVS3RR/The-Product-Map-3.1?type=whiteboard&node-id=183-8734&t=aENtCOSbBGKwDMTu-4,Excel in Scrum framework. Focus on product vision & planning and backlog management skills in this foundational Agile course,"""Scrum"" provides a comprehensive understanding of the Scrum framework, a popular Agile methodology for iterative product development. Positioned within the Agile domain, this course delves into the principles, roles, and ceremonies of Scrum. Participants will learn how to facilitate Scrum events, manage product backlogs, and foster collaboration within cross-functional teams. Skills cultivated include developing a clear 'Product Vision & Planning' framework to guide Sprint planning and backlog refinement, as well as proficient 'Backlog Management' techniques to prioritize and groom user stories effectively. By course completion, participants will be empowered to implement Scrum methodologies, drive successful Sprint cycles, and deliver value to stakeholders iteratively."
Scaling,Agile,Product People,Strategic Impact Team Leadership,4,5,KcYxc4r2dUhd3fRXMWNreLvh7U52,2024-01-28,https://www.figma.com/file/SABujfIEwzpa1NuWiVS3RR/The-Product-Map-3.1?type=whiteboard&node-id=183-8782&t=aENtCOSbBGKwDMTu-4,Master Agile scaling. Develop strategic impact and team leadership skills in this advanced Agile course,"""Scaling"" explores strategies and techniques for effectively scaling Agile practices to larger teams and organizations. Situated within the Agile domain, this course delves into the challenges and opportunities of scaling Agile beyond individual teams to entire organizations. Participants will learn to align Agile practices with strategic objectives, foster a culture of continuous improvement, and facilitate collaboration across multiple teams or departments. Skills cultivated include understanding the 'Strategic Impact' of scaling Agile methodologies on organizational outcomes and developing effective 'Team Leadership' skills to support and empower Agile teams at scale. By course completion, participants will be equipped to lead Agile transformations, drive organizational agility, and achieve sustainable growth and success."
Lean Approach,Lean,Processes People,Product Vision Planning Team Leadership,1,3,KcYxc4r2dUhd3fRXMWNreLvh7U52,2024-01-28,https://www.figma.com/file/SABujfIEwzpa1NuWiVS3RR/The-Product-Map-3.1?type=whiteboard&node-id=175-6758&t=aENtCOSbBGKwDMTu-4,Embrace Lean principles. Focus on product vision & planning and team leadership skills in this foundational Lean course,"""Lean Approach"" delves into the principles and practices of Lean methodology, emphasizing efficiency, waste reduction, and continuous improvement. Positioned within the Lean domain, this course provides participants with insights into streamlining processes, optimizing workflows, and maximizing value delivery. Participants will learn to apply Lean principles to product development, project management, and organizational processes. Skills cultivated include developing a clear 'Product Vision & Planning' framework aligned with Lean principles and fostering effective 'Team Leadership' to drive Lean initiatives and empower teams to identify and eliminate waste. By course completion, participants will be equipped to implement Lean methodologies, streamline operations, and drive sustainable improvement across their organizations."
Loss Exposure Identification,Lean,Product,Strategic Impact,3,5,KcYxc4r2dUhd3fRXMWNreLvh7U52,2024-01-28,https://www.figma.com/file/SABujfIEwzpa1NuWiVS3RR/The-Product-Map-3.1?type=whiteboard&node-id=175-6771&t=aENtCOSbBGKwDMTu-4,Identify loss exposure. Develop strategic impact skills in this essential Lean course focused on product enhancement,"""Loss Exposure Identification"" focuses on identifying and mitigating potential losses within business operations, aligning with Lean principles. Situated within the Lean domain, this course equips participants with the tools and techniques to identify areas of waste, inefficiency, or risk exposure within processes. Participants will learn to conduct thorough analyses to uncover potential loss points and develop strategies to mitigate these risks effectively. Skills cultivated include understanding the 'Strategic Impact' of loss exposure identification on organizational outcomes, enabling participants to make informed decisions to enhance efficiency and minimize losses. By course completion, participants will be equipped to proactively address potential risks, optimize processes, and drive continuous improvement within their organizations."
