title,topic_group,skill_groups,skills,grade_low,grade_high,author_id,created_at,figma_link,description,extended_description
Software Development Lifecycle,Software Development,Processes People,Software Engineering Team Leadership,1,3,KcYxc4r2dUhd3fRXMWNreLvh7U52,2024-01-28,https://www.figma.com/file/SABujfIEwzpa1NuWiVS3RR/The-Product-Map-3.1?type=whiteboard&node-id=474-18678&t=aENtCOSbBGKwDMTu-4,Navigate software lifecycles. Develop software engineering and team leadership skills in this comprehensive development course,"""Software Development Lifecycle"" provides a comprehensive overview of the processes and methodologies involved in developing software from inception to deployment. Positioned within the Software Development domain, this course equips participants with the knowledge and skills to navigate the various stages of the software development lifecycle effectively. Participants will learn about different development methodologies, such as Agile, Waterfall, and DevOps, and how to tailor them to project requirements. Skills cultivated include proficiency in 'Software Engineering' practices to design, develop, and test software solutions, as well as effective 'Team Leadership' to coordinate and empower development teams throughout the lifecycle. By course completion, participants will be equipped to lead successful software development projects, deliver high-quality products, and drive continuous improvement within their development teams."
Frontend,Software Development,Processes,Backlog Management Software Engineering,2,3,KcYxc4r2dUhd3fRXMWNreLvh7U52,2024-01-28,https://www.figma.com/file/SABujfIEwzpa1NuWiVS3RR/The-Product-Map-3.1?type=whiteboard&node-id=479-19387&t=aENtCOSbBGKwDMTu-4,Master frontend development. Focus on backlog management and software engineering skills in this specialized software development course,"""Frontend"" focuses on the development of the user-facing aspects of software applications, covering the design and implementation of user interfaces and experiences. Positioned within the Software Development domain, this course equips participants with the skills and techniques necessary to build engaging and responsive frontend components. Participants will learn about frontend technologies, such as HTML, CSS, and JavaScript, and best practices for creating intuitive user interfaces. Skills cultivated include effective 'Backlog Management' to prioritize and plan frontend development tasks, as well as proficiency in 'Software Engineering' principles to implement frontend features efficiently and maintainable. By course completion, participants will be equipped to design and develop frontend components that meet user needs and contribute to the overall success of software projects."
Backend,Software Development,Processes,Backlog Management Software Engineering,2,3,KcYxc4r2dUhd3fRXMWNreLvh7U52,2024-01-28,https://www.figma.com/file/SABujfIEwzpa1NuWiVS3RR/The-Product-Map-3.1?type=whiteboard&node-id=479-19409&t=aENtCOSbBGKwDMTu-4,Excel in backend development. Focus on backlog management and software engineering skills in this essential software development course,"""Backend"" focuses on the development of the server-side components and logic that power software applications, handling data processing, business logic, and server interactions. Positioned within the Software Development domain, this course equips participants with the skills and techniques necessary to build robust and scalable backend systems. Participants will learn about backend technologies, such as server-side programming languages (e.g., Python, Java, Node.js) and databases (e.g., SQL, NoSQL), and best practices for designing efficient and secure backend architectures. Skills cultivated include effective 'Backlog Management' to prioritize and plan backend development tasks, as well as proficiency in 'Software Engineering' principles to implement backend features efficiently and maintainably. By course completion, participants will be equipped to design and develop backend systems that meet performance, scalability, and security requirements, contributing to the overall success of software projects."
Risk Management Process,Risk Management,Processes People,Product Vision Planning Team Leadership,2,5,KcYxc4r2dUhd3fRXMWNreLvh7U52,2024-01-28,https://www.figma.com/file/SABujfIEwzpa1NuWiVS3RR/The-Product-Map-3.1?type=whiteboard&node-id=148-2840&t=aENtCOSbBGKwDMTu-4,Master risk management. Focus on product vision & planning and team leadership skills in this critical course,"""Risk Management Process"" delves into strategies and methodologies for identifying, assessing, and mitigating risks within projects and organizations. Positioned within the Risk Management domain, this course equips participants with the tools and techniques necessary to proactively manage risks throughout the project lifecycle. Participants will learn to develop risk management plans, conduct risk assessments, and implement risk mitigation strategies effectively. Skills cultivated include developing a clear 'Product Vision & Planning' framework to align risk management activities with project objectives and fostering effective 'Team Leadership' to coordinate risk management efforts and empower teams to address and mitigate risks proactively. By course completion, participants will be equipped to anticipate and manage risks effectively, enhancing project outcomes and organizational resilience."
Risk Control Supportive Concepts,Risk Management,Processes People,Product Vision Planning Team Leadership,3,5,KcYxc4r2dUhd3fRXMWNreLvh7U52,2024-01-28,https://www.figma.com/file/SABujfIEwzpa1NuWiVS3RR/The-Product-Map-3.1?type=whiteboard&node-id=148-2869&t=aENtCOSbBGKwDMTu-4,Enhance risk control. Develop product vision & planning and team leadership skills in this advanced risk management course,"""Risk Control Supportive Concepts"" provides a comprehensive exploration of concepts and strategies that support effective risk control within projects and organizations. Situated within the Risk Management domain, this course equips participants with the knowledge and skills to implement proactive measures to control and mitigate risks throughout the project lifecycle. Participants will learn about various risk control techniques, such as risk avoidance, risk reduction, and risk transfer, and how to apply them in real-world scenarios. Skills cultivated include developing a clear 'Product Vision & Planning' framework to align risk control activities with project objectives and fostering effective 'Team Leadership' to implement risk control measures and empower teams to address and mitigate risks proactively. By course completion, participants will be equipped to implement robust risk control strategies, enhance project outcomes, and strengthen organizational resilience."
Negotiation Strategy,Negotiation,Analytics People,Stakeholder Management Communication,1,5,KcYxc4r2dUhd3fRXMWNreLvh7U52,2024-01-28,https://www.figma.com/file/SABujfIEwzpa1NuWiVS3RR/The-Product-Map-3.1?type=whiteboard&node-id=34409-13813&t=aENtCOSbBGKwDMTu-4,Refine negotiation tactics. Cultivate stakeholder management and communication skills in this analytics-driven negotiation strategy course,"""Negotiation Strategy"" explores the principles and techniques essential for achieving favorable outcomes in negotiations. Positioned within the Negotiation domain, this course equips participants with the skills and insights needed to navigate complex negotiation scenarios effectively. Participants will learn about negotiation frameworks, tactics, and strategies for creating value and resolving conflicts. Skills cultivated include adept 'Stakeholder Management' to understand and address stakeholders' interests and concerns, as well as effective 'Communication' skills to convey messages persuasively and build rapport during negotiations. By course completion, participants will be equipped to develop and implement negotiation strategies that lead to mutually beneficial agreements and strengthened relationships with stakeholders."
Negotiation Tips,Negotiation,People,People Development Communication,1,3,KcYxc4r2dUhd3fRXMWNreLvh7U52,2024-01-28,https://www.figma.com/file/SABujfIEwzpa1NuWiVS3RR/The-Product-Map-3.1?type=whiteboard&node-id=34409-14219&t=aENtCOSbBGKwDMTu-4,Master negotiation essentials. Cultivate people development and communication skills in this focused negotiation tips course,"""Negotiation Tips"" offers practical insights and techniques to enhance negotiation effectiveness. Situated within the Negotiation domain, this course provides participants with actionable strategies for navigating various negotiation scenarios successfully. Participants will learn valuable tips for building rapport, managing emotions, and reaching mutually beneficial agreements. Skills cultivated include fostering 'People Development' by understanding and adapting to different negotiation styles and honing effective 'Communication' skills to articulate interests and influence outcomes positively. By course completion, participants will be equipped with a toolkit of negotiation tips and tactics to leverage in a wide range of negotiation situations, leading to improved outcomes and strengthened relationships with counterparts."
Facilitation,Soft Skills,People,Team Leadership Communication,1,3,KcYxc4r2dUhd3fRXMWNreLvh7U52,2024-01-28,https://www.figma.com/file/SABujfIEwzpa1NuWiVS3RR/The-Product-Map-3.1?type=whiteboard&node-id=34409-13419&t=aENtCOSbBGKwDMTu-4,Excel in facilitation. Cultivate team leadership and communication skills in this essential soft skills course,"""Facilitation"" delves into the art and science of guiding groups towards productive and collaborative outcomes. Situated within the Soft Skills domain, this course equips participants with the skills and techniques needed to facilitate meetings, workshops, and group discussions effectively. Participants will learn how to foster a positive and inclusive environment, manage group dynamics, and encourage participation and engagement. Skills cultivated include effective 'Team Leadership' to guide groups towards common goals and facilitate decision-making processes, as well as adept 'Communication' skills to convey information clearly and build rapport with participants. By course completion, participants will be equipped to lead and facilitate productive and engaging sessions that drive meaningful outcomes and foster collaboration among team members."
Leadership,Soft Skills,People,Team Leadership People Development,1,5,KcYxc4r2dUhd3fRXMWNreLvh7U52,2024-01-28,https://www.figma.com/file/SABujfIEwzpa1NuWiVS3RR/The-Product-Map-3.1?type=whiteboard&node-id=34409-13667&t=aENtCOSbBGKwDMTu-4,Develop leadership prowess. Cultivate team leadership and people development skills in this foundational soft skills course,"""Leadership"" provides a comprehensive exploration of the principles and practices essential for effective leadership in various contexts. Positioned within the Soft Skills domain, this course equips participants with the skills and insights needed to inspire, motivate, and guide individuals and teams towards achieving common goals. Participants will learn about different leadership styles, communication techniques, and strategies for fostering a positive and inclusive work environment. Skills cultivated include proficient 'Team Leadership' to guide and support teams effectively, as well as fostering 'People Development' by nurturing talent, empowering team members, and fostering growth and development. By course completion, participants will be equipped with the knowledge and skills to lead with confidence, drive organizational success, and cultivate high-performing teams."
Team Growth,"Talent, HR",People,People Development Communication,3,5,KcYxc4r2dUhd3fRXMWNreLvh7U52,2024-01-28,https://www.figma.com/file/SABujfIEwzpa1NuWiVS3RR/The-Product-Map-3.1?type=whiteboard&node-id=34409-14761&t=aENtCOSbBGKwDMTu-4,Foster team growth. Develop people development and communication skills in this HR-focused course,"""Team Growth"" focuses on fostering the development and cohesion of teams to achieve their full potential. Positioned within the Talent and HR domain, this course explores strategies and practices for nurturing team dynamics, enhancing collaboration, and maximizing individual and collective performance. Participants will learn techniques for fostering a supportive team culture, resolving conflicts constructively, and leveraging diverse talents and perspectives. Skills cultivated include effective 'People Development' to support the growth and skill enhancement of team members, and adept 'Communication' skills to foster open dialogue and alignment within the team. By course completion, participants will be equipped to cultivate a culture of continuous improvement, drive team effectiveness, and achieve sustainable growth and success."
Performance Management,"Talent, HR",People,People Development Communication,4,5,KcYxc4r2dUhd3fRXMWNreLvh7U52,2024-01-28,https://www.figma.com/file/SABujfIEwzpa1NuWiVS3RR/The-Product-Map-3.1?type=whiteboard&node-id=34409-14776&t=aENtCOSbBGKwDMTu-4,Optimize performance management. Develop people development and communication skills in this essential HR course,"""Performance Management"" is a comprehensive exploration of strategies and techniques for evaluating and enhancing individual and team performance within an organization. Situated within the Talent and HR domain, this course equips participants with the skills and insights needed to establish performance goals, provide constructive feedback, and facilitate professional growth and development. Participants will learn about performance appraisal methods, performance metrics, and effective performance improvement strategies. Skills cultivated include fostering 'People Development' by providing support and guidance to employees in achieving their performance objectives, and leveraging effective 'Communication' to facilitate performance discussions and address performance-related issues. By course completion, participants will be equipped to implement performance management processes that drive employee engagement, productivity, and organizational success."
Skills Assessment,"Talent, HR",People,Team Leadership People Development,3,5,KcYxc4r2dUhd3fRXMWNreLvh7U52,2024-01-28,https://www.figma.com/file/SABujfIEwzpa1NuWiVS3RR/The-Product-Map-3.1?type=whiteboard&node-id=34409-14791&t=aENtCOSbBGKwDMTu-4,Refine skills assessment. Cultivate team leadership and people development skills in this HR-focused course,"""Skills Assessment"" is a comprehensive exploration of evaluating and enhancing the skill sets of individuals within an organization. Positioned within the Talent and HR domain, this course equips participants with the tools and methodologies needed to assess the skills and competencies of employees effectively. Participants will learn about various assessment techniques, such as self-assessment, peer assessment, and competency-based assessments. Skills cultivated include proficient 'Team Leadership' to guide and support employees through the assessment process, as well as fostering 'People Development' by identifying skill gaps and providing opportunities for skill enhancement and professional growth. By course completion, participants will be equipped to conduct thorough skills assessments, provide targeted feedback, and implement strategies to develop and leverage the skills of employees effectively, contributing to organizational success and growth."
